{
  "version": "1.1.0",
  "description": "Canonical KCC Crown UI design tokens, originally seeded from the removed apps/mobile design tokens (recoverable at the legacy-final git tag). iOS, Android, and admin web must consume these values; do not hard-code colors, spacing, radii, or type sizes in platform code. Spacing, radius, and typography sizes are density-independent points/dp. Theme colors are literal hex — when a value also exists in the palette, keep them in sync in the same PR.",
  "palette": {
    "crownGold": "#EAB54B",
    "darkCharcoal": "#3F3E3B",
    "inkBlack": "#040211",
    "warmIvory": "#F8F6EF",
    "softSand": "#F0EBDC",
    "mutedGrey": "#6D6C6D",
    "silverGrey": "#B4B1AD",
    "successGreen": "#1E8E3E",
    "errorRed": "#C5221F",
    "warningAmber": "#E6A817",
    "nightOverlay": "#121A27",
    "driverCyan": "#49DDEB"
  },
  "spacing": {
    "0": 0,
    "1": 4,
    "2": 8,
    "3": 12,
    "4": 16,
    "5": 20,
    "6": 24,
    "8": 32,
    "10": 40,
    "12": 48
  },
  "radius": {
    "sm": 8,
    "md": 12,
    "lg": 16,
    "xl": 24,
    "full": 9999
  },
  "typography": {
    "family": {
      "primary": "System"
    },
    "size": {
      "caption": 12,
      "bodySm": 14,
      "bodyMd": 16,
      "titleMd": 18,
      "headingLg": 24
    },
    "weight": {
      "regular": "400",
      "medium": "500",
      "semibold": "600"
    }
  },
  "themes": {
    "light": {
      "colors": {
        "pageBackground": "#F8F6EF",
        "surfaceBackground": "#FFFFFF",
        "subtleBackground": "#F0EBDC",
        "textPrimary": "#040211",
        "textSecondary": "#6D6C6D",
        "borderDefault": "#B4B1AD",
        "brandPrimary": "#EAB54B",
        "statusSuccess": "#1E8E3E",
        "statusError": "#C5221F",
        "statusWarning": "#E6A817",
        "overlayBackground": "#FFFFFF",
        "overlayBorder": "#B4B1AD",
        "driverActive": "#007582",
        "onDriverActive": "#FFFFFF",
        "onBrandPrimary": "#040211"
      }
    },
    "dark": {
      "colors": {
        "pageBackground": "#040211",
        "surfaceBackground": "#121A27",
        "subtleBackground": "#0B111B",
        "textPrimary": "#F8F6EF",
        "textSecondary": "#B4B1AD",
        "borderDefault": "#526172",
        "brandPrimary": "#EAB54B",
        "statusSuccess": "#1E8E3E",
        "statusError": "#C5221F",
        "statusWarning": "#E6A817",
        "overlayBackground": "#121A27",
        "overlayBorder": "#526172",
        "driverActive": "#49DDEB",
        "onDriverActive": "#040211",
        "onBrandPrimary": "#040211"
      }
    }
  }
}
